{
  "$schema": "https://json-schema.org/draft/2020-12/schema",
  "$id": "https://pknull.dev/asha/broker-capabilities.schema.json",
  "type": "object",
  "additionalProperties": false,
  "required": ["schema_version", "harness_registry", "ownership", "capabilities"],
  "properties": {
    "$schema": {"type": "string"},
    "schema_version": {"const": 1},
    "harness_registry": {
      "type": "object",
      "additionalProperties": false,
      "required": ["path", "schema_version"],
      "properties": {
        "path": {"type": "string", "const": "../../../harnesses/capabilities.json"},
        "schema_version": {"const": 3}
      }
    },
    "ownership": {"$ref": "#/$defs/ownership"},
    "capabilities": {
      "type": "array",
      "minItems": 1,
      "items": {"$ref": "#/$defs/capability"}
    }
  },
  "$defs": {
    "ownership": {
      "type": "object",
      "additionalProperties": false,
      "required": ["owner", "version"],
      "properties": {
        "owner": {"type": "string", "minLength": 1},
        "version": {"type": "string", "pattern": "^[0-9]+\\.[0-9]+\\.[0-9]+$"}
      }
    },
    "condition": {
      "description": "Typed, data-only activation condition. The resolver evaluates it; it never runs a command.",
      "oneOf": [
        {"type": "object", "additionalProperties": false, "required": ["type"], "properties": {"type": {"const": "always"}}},
        {"type": "object", "additionalProperties": false, "required": ["type", "command"], "properties": {"type": {"const": "command-missing"}, "command": {"type": "string", "pattern": "^[A-Za-z0-9][A-Za-z0-9._+-]{0,63}$"}}}
      ]
    },
    "dependency": {
      "type": "object",
      "additionalProperties": false,
      "required": ["id", "relation"],
      "properties": {
        "id": {"type": "string", "pattern": "^[a-z0-9][a-z0-9.-]+$"},
        "relation": {"enum": ["requires", "optional"]},
        "when": {"$ref": "#/$defs/condition"},
        "reason": {"type": "string", "minLength": 1}
      }
    },
    "supportRef": {
      "type": "object",
      "additionalProperties": false,
      "required": ["capability_ref", "fallback"],
      "properties": {
        "capability_ref": {"type": "string", "pattern": "^(claude|codex|copilot|opencode)\\.capabilities\\.[a-z-]+$"},
        "fallback": {"type": "string", "minLength": 1}
      }
    },
    "capability": {
      "type": "object",
      "additionalProperties": false,
      "required": ["id", "kind", "description", "categories", "task_patterns", "prerequisites", "required_config", "risk", "approval", "output_contract", "permissions", "harness_support", "fallback", "ownership"],
      "properties": {
        "id": {"type": "string", "pattern": "^[a-z0-9][a-z0-9.-]+$"},
        "kind": {"enum": ["agent", "skill", "command", "tool", "process-template"]},
        "description": {"type": "string", "minLength": 1},
        "categories": {"type": "array", "items": {"type": "string"}, "uniqueItems": true},
        "task_patterns": {"type": "array", "items": {"type": "string"}, "uniqueItems": true},
        "prerequisites": {"type": "array", "items": {"type": "string"}, "uniqueItems": true},
        "required_config": {"type": "array", "items": {"type": "string"}, "uniqueItems": true},
        "risk": {"enum": ["low", "medium", "high"]},
        "approval": {"type": "array", "items": {"type": "string"}, "uniqueItems": true},
        "output_contract": {"type": "string", "minLength": 1},
        "permissions": {"type": "array", "items": {"enum": ["read", "propose"]}, "uniqueItems": true},
        "harness_support": {
          "type": "object",
          "additionalProperties": false,
          "required": ["claude", "codex", "copilot", "opencode"],
          "properties": {
            "claude": {"$ref": "#/$defs/supportRef"},
            "codex": {"$ref": "#/$defs/supportRef"},
            "copilot": {"$ref": "#/$defs/supportRef"},
            "opencode": {"$ref": "#/$defs/supportRef"}
          }
        },
        "fallback": {"type": "string", "minLength": 1},
        "ownership": {"$ref": "#/$defs/ownership"},
        "dependencies": {
          "description": "Capability dependencies (#124): targets exist, appear once, do not repeat process.capability_ids, and form no cycle, inactive edges included. Overrides may not change them.",
          "type": "array",
          "items": {"$ref": "#/$defs/dependency"}
        },
        "process": {
          "type": "object",
          "additionalProperties": false,
          "required": ["priority", "verification", "capability_ids"],
          "properties": {
            "priority": {"type": "integer", "minimum": 0},
            "verification": {"type": "array", "items": {"type": "string"}},
            "capability_ids": {"type": "array", "items": {"type": "string"}, "uniqueItems": true}
          }
        }
      }
    }
  }
}
