{
  "$schema": "./capabilities.schema.json",
  "schema_version": 1,
  "harness_registry": {
    "path": "../../../harnesses/capabilities.json",
    "schema_version": 3
  },
  "ownership": {
    "owner": "asha/session",
    "version": "1.0.0"
  },
  "capabilities": [
    {
      "id": "process-router",
      "kind": "agent",
      "description": "Recommend a process with prerequisites, risks, approvals, verification, and fallback.",
      "categories": [
        "routing",
        "process"
      ],
      "task_patterns": [
        "route",
        "process",
        "workflow"
      ],
      "prerequisites": [],
      "required_config": [],
      "risk": "low",
      "approval": [],
      "output_contract": "asha.process-route.v1",
      "permissions": [
        "read",
        "propose"
      ],
      "harness_support": {
        "claude": {
          "capability_ref": "claude.capabilities.agents",
          "fallback": "Run asha process route inline."
        },
        "codex": {
          "capability_ref": "codex.capabilities.agents",
          "fallback": "Run asha process route inline."
        },
        "copilot": {
          "capability_ref": "copilot.capabilities.agents",
          "fallback": "Run asha process route inline."
        },
        "opencode": {
          "capability_ref": "opencode.capabilities.agents",
          "fallback": "Run asha process route inline."
        }
      },
      "fallback": "Run the deterministic routing protocol inline.",
      "ownership": {
        "owner": "asha/session",
        "version": "1.0.0"
      }
    },
    {
      "id": "capability-broker",
      "kind": "agent",
      "description": "Match a task and route to verified registry capabilities without executing them.",
      "categories": [
        "routing",
        "capability"
      ],
      "task_patterns": [
        "capability",
        "agent",
        "skill",
        "tool"
      ],
      "prerequisites": [],
      "required_config": [],
      "risk": "low",
      "approval": [],
      "output_contract": "asha.capability-match.v1",
      "permissions": [
        "read",
        "propose"
      ],
      "harness_support": {
        "claude": {
          "capability_ref": "claude.capabilities.agents",
          "fallback": "Run asha capabilities match inline."
        },
        "codex": {
          "capability_ref": "codex.capabilities.agents",
          "fallback": "Run asha capabilities match inline."
        },
        "copilot": {
          "capability_ref": "copilot.capabilities.agents",
          "fallback": "Run asha capabilities match inline."
        },
        "opencode": {
          "capability_ref": "opencode.capabilities.agents",
          "fallback": "Run asha capabilities match inline."
        }
      },
      "fallback": "Run the deterministic matching protocol inline.",
      "ownership": {
        "owner": "asha/session",
        "version": "1.0.0"
      }
    },
    {
      "id": "process.code-review",
      "kind": "process-template",
      "description": "Independent code review before implementation changes.",
      "categories": [
        "code-review"
      ],
      "task_patterns": [
        "review",
        "audit",
        "inspect",
        "regression",
        "security review"
      ],
      "prerequisites": [
        "defined-review-scope"
      ],
      "required_config": [],
      "risk": "low",
      "approval": [],
      "output_contract": "asha.process-route.v1",
      "permissions": [
        "read",
        "propose"
      ],
      "harness_support": {
        "claude": {
          "capability_ref": "claude.capabilities.agents",
          "fallback": "Apply the review checklist inline."
        },
        "codex": {
          "capability_ref": "codex.capabilities.agents",
          "fallback": "Apply the review checklist inline."
        },
        "copilot": {
          "capability_ref": "copilot.capabilities.agents",
          "fallback": "Apply the review checklist inline."
        },
        "opencode": {
          "capability_ref": "opencode.capabilities.agents",
          "fallback": "Apply the review checklist inline."
        }
      },
      "fallback": "Review inline and report findings; make no edits unless separately requested.",
      "ownership": {
        "owner": "asha/code",
        "version": "1.0.0"
      },
      "process": {
        "priority": 20,
        "verification": [
          "scope-specific tests",
          "diff inspection"
        ],
        "capability_ids": [
          "code-review"
        ]
      }
    },
    {
      "id": "process.debugging",
      "kind": "process-template",
      "description": "Reproduce, isolate, fix, and regression-test a failure.",
      "categories": [
        "debugging"
      ],
      "task_patterns": [
        "debug",
        "bug",
        "failure",
        "failing",
        "error",
        "broken",
        "regression"
      ],
      "prerequisites": [
        "reproduction-or-observable-failure"
      ],
      "required_config": [],
      "risk": "medium",
      "approval": [],
      "output_contract": "asha.process-route.v1",
      "permissions": [
        "read",
        "propose"
      ],
      "harness_support": {
        "claude": {
          "capability_ref": "claude.capabilities.agents",
          "fallback": "Run the debugging protocol inline."
        },
        "codex": {
          "capability_ref": "codex.capabilities.agents",
          "fallback": "Run the debugging protocol inline."
        },
        "copilot": {
          "capability_ref": "copilot.capabilities.agents",
          "fallback": "Run the debugging protocol inline."
        },
        "opencode": {
          "capability_ref": "opencode.capabilities.agents",
          "fallback": "Run the debugging protocol inline."
        }
      },
      "fallback": "Reproduce, isolate, patch, and regression-test inline.",
      "ownership": {
        "owner": "asha/code",
        "version": "1.0.0"
      },
      "process": {
        "priority": 30,
        "verification": [
          "reproduction fails before fix",
          "regression passes after fix"
        ],
        "capability_ids": [
          "debugger",
          "code-verify"
        ]
      }
    },
    {
      "id": "process.tdd",
      "kind": "process-template",
      "description": "Write a failing test, implement the minimum fix, then refactor.",
      "categories": [
        "tdd"
      ],
      "task_patterns": [
        "tdd",
        "test driven",
        "test-driven",
        "tests first"
      ],
      "prerequisites": [
        "test-runner"
      ],
      "required_config": [],
      "risk": "medium",
      "approval": [],
      "output_contract": "asha.process-route.v1",
      "permissions": [
        "read",
        "propose"
      ],
      "harness_support": {
        "claude": {
          "capability_ref": "claude.capabilities.agents",
          "fallback": "Run red-green-refactor inline."
        },
        "codex": {
          "capability_ref": "codex.capabilities.agents",
          "fallback": "Run red-green-refactor inline."
        },
        "copilot": {
          "capability_ref": "copilot.capabilities.agents",
          "fallback": "Run red-green-refactor inline."
        },
        "opencode": {
          "capability_ref": "opencode.capabilities.agents",
          "fallback": "Run red-green-refactor inline."
        }
      },
      "fallback": "Run red-green-refactor inline.",
      "ownership": {
        "owner": "asha/code",
        "version": "1.0.0"
      },
      "process": {
        "priority": 10,
        "verification": [
          "new test fails first",
          "targeted tests pass",
          "refactor preserves behavior"
        ],
        "capability_ids": [
          "tdd",
          "code-verify"
        ]
      }
    },
    {
      "id": "process.research",
      "kind": "process-template",
      "description": "Inspect local prior art, then identify authoritative current claims that require approved network research.",
      "categories": [
        "research"
      ],
      "task_patterns": [
        "research",
        "verify",
        "latest",
        "current",
        "source",
        "evidence"
      ],
      "prerequisites": [
        "authoritative-sources"
      ],
      "required_config": [],
      "risk": "low",
      "approval": [
        "network-access-if-required"
      ],
      "output_contract": "asha.process-route.v1",
      "permissions": [
        "read",
        "propose"
      ],
      "harness_support": {
        "claude": {
          "capability_ref": "claude.capabilities.agents",
          "fallback": "Research inline with citations."
        },
        "codex": {
          "capability_ref": "codex.capabilities.agents",
          "fallback": "Research inline with citations."
        },
        "copilot": {
          "capability_ref": "copilot.capabilities.agents",
          "fallback": "Research inline with citations."
        },
        "opencode": {
          "capability_ref": "opencode.capabilities.agents",
          "fallback": "Research inline with citations."
        }
      },
      "fallback": "Use codebase-historian for local prior art only; with network approval, research authoritative current sources inline and cite each external claim.",
      "ownership": {
        "owner": "asha/session",
        "version": "1.0.0"
      },
      "process": {
        "priority": 40,
        "verification": [
          "primary-source citations",
          "claim-to-source trace"
        ],
        "capability_ids": [
          "codebase-historian"
        ]
      }
    },
    {
      "id": "process.multi-repository",
      "kind": "process-template",
      "description": "Coordinate bounded changes across declared repositories without creating worktrees.",
      "categories": [
        "multi-repository",
        "workspace"
      ],
      "task_patterns": [